episode,agent_version,prompt_t-2,reward_t-2,prompt_t-1,reward_t-1,action_prompt,response_sample,avg_reward,worst_question,worst_reference,worst_prediction,worst_score
1,MDP-v3,,0.0,You are a helpful assistant.,0.0,"질문에 대해 핵심 결론을 먼저 제시하는 두괄식 구조로 답변하십시오.  
문맥에서 확인된 사실과 근거를 논리적으로 연결하여 명확하고 간결하게 설명하고, 필요 시 단계별로 구체적인 세부사항을 포함하십시오.  
불필요한 감정 표현이나 장황한 서론은 배제하고, 전문적이고 중립적인 어투를 유지하며 독자가 빠르게 이해할 수 있도록 체계적으로 서술하십시오.  
모든 정보는 문맥에서 확인된 내용에 기반하고, 사실·원인·결과·의미를 균형 있게 담아 한 눈에 이해 가능한 완결된 답변을 작성하십시오.","결론: 1923년 잉글랜드 FA컵 결승전 당시 영국의 국왕은 **조지 5세(George V)**였다.  

근거: 참고 문서에 따르면 경기 진행이 어려워 보이는 상황에서 “영국의 왕 조지 5세가 도착하자 관중들 사이의 분위기가 바뀌었다”고 기록되어 있다. 이는 해당 시점의 재위 군주가 조지 5세였음을 명확히 보여준다.  

결과·의미: 조지 5세의 등장으로 혼란스러운 관중 상황이 일부 진정되었으며, 관중들이 국가를 제창한 뒤 경기 진행을 위한 공간 확보에 협조하게 되어 경기가 예정대로 진행될 수 있었다.",0.5200875558332485,전통적이고 기호적인 방법으로서의 인공지능 연구 분야는 무엇인가?,깔끔이(Neats),"결론: 전통적이고 기호적인 방법으로서의 인공지능 연구 분야는 **깔끔이(Neats)**이다.  

**근거 및 설명**  
1. 참고 문서에서 깔끔이는 ""전통적 혹은 기호적(symbolic) 인공지능 연구""라고 명시됨.  
2. 이 분야는 추상적 개념에 대한 **기호적 연산**과 **전문가 시스템(expert systems)** 개발 방법론을 포함함.  
3. 깔끔이 접근법은 규칙 기반 설계와 명시적 지식 표현을 중심으로 지능을 구현하는 것을 특징으로 함.  

**요약**  
깔끔이(Neats) = 전통적·기호적 AI → 기호 연산 + 전문가 시스템 중심 접근.",0.4397324506713992
2,MDP-v3,You are a helpful assistant.,0.0,"질문에 대해 핵심 결론을 먼저 제시하는 두괄식 구조로 답변하십시오.  
문맥에서 확인된 사실과 근거를 논리적으로 연결하여 명확하고 간결하게 설명하고, 필요 시 단계별로 구체적인 세부사항을 포함하십시오.  
불필요한 감정 표현이나 장황한 서론은 배제하고, 전문적이고 중립적인 어투를 유지하며 독자가 빠르게 이해할 수 있도록 체계적으로 서술하십시오.  
모든 정보는 문맥에서 확인된 내용에 기반하고, 사실·원인·결과·의미를 균형 있게 담아 한 눈에 이해 가능한 완결된 답변을 작성하십시오.",0.5200875558332485,"질문에 대한 핵심 답을 첫 문장에서 간단하고 정확하게 제시하십시오. 이후에는 문맥에서 확인된 주요 개념, 정의, 특징, 관련 예시를 짧고 명료한 문장으로 보충 설명하십시오. 불필요한 결론 표기나 감정적 표현은 배제하고, 전문적·중립적 어투를 유지하십시오. 정보는 반드시 제공된 문맥에 근거하며, 사실을 우선적으로 전달하고 필요 시 개념 간 관계나 배경을 간결하게 덧붙이되, 전체 답변은 한눈에 파악할 수 있게 완결성을 갖추십시오.","이휘소가 택한 대한민국의 숙소는 **주한 미국 대사관 직원 숙소**이다.  
그는 박정희 정권에 대한 경계심이 강했고, 미국 정부 대표단의 일원으로 방문했지만 안전을 위해 주한미군 용산기지 인근에 위치한 이 숙소를 선택했다.  
추가로, 만약 위협 상황이 발생할 경우 즉시 도움을 요청할 연락처를 페르미랩 비서에게 전달해 두었다.",0.49296538532156137,헨리에타와 필리프의 결혼 기념일은?,1661년 3월 31일,"헨리에타와 필리프의 결혼 기념일은 1661년 3월 31일이다.  
1661년 3월 31일에 프랑스로 돌아온 헨리에타는 필리프와 혼인했다.  
필리프는 동성애자였고 결혼 생활은 원만하지 않았다.  
헨리에타는 시아주버니 루이 14세와 가까워졌으나 시녀 루이즈 드 라 발리에르가 루이 14세의 애첩이 되면서 관계를 단념했다.  
부부 사이에 마리 루이즈, 필리프 샤를, 안나 마리아가 태어났지만 불화가 지속되었다.  
필리프가 애인을 생클루 성으로 데려오자 헨리에타는 루이 14세에게 호소했고, 루이 14세는 로렌 공을 외딴 섬에 유배시켰다.",0.38096731700214315
3,MDP-v3,"질문에 대해 핵심 결론을 먼저 제시하는 두괄식 구조로 답변하십시오.  
문맥에서 확인된 사실과 근거를 논리적으로 연결하여 명확하고 간결하게 설명하고, 필요 시 단계별로 구체적인 세부사항을 포함하십시오.  
불필요한 감정 표현이나 장황한 서론은 배제하고, 전문적이고 중립적인 어투를 유지하며 독자가 빠르게 이해할 수 있도록 체계적으로 서술하십시오.  
모든 정보는 문맥에서 확인된 내용에 기반하고, 사실·원인·결과·의미를 균형 있게 담아 한 눈에 이해 가능한 완결된 답변을 작성하십시오.",0.5200875558332485,"질문에 대한 핵심 답을 첫 문장에서 간단하고 정확하게 제시하십시오. 이후에는 문맥에서 확인된 주요 개념, 정의, 특징, 관련 예시를 짧고 명료한 문장으로 보충 설명하십시오. 불필요한 결론 표기나 감정적 표현은 배제하고, 전문적·중립적 어투를 유지하십시오. 정보는 반드시 제공된 문맥에 근거하며, 사실을 우선적으로 전달하고 필요 시 개념 간 관계나 배경을 간결하게 덧붙이되, 전체 답변은 한눈에 파악할 수 있게 완결성을 갖추십시오.",0.49296538532156137,"질문에 대한 답변은 문맥에서 확인된 핵심 정보만을 사용하여, 첫 문장에서 간결하고 정확하게 결론을 제시하십시오. 추가 설명은 반드시 질문에 직접 관련된 필수 사실이나 수치를 보충하는 범위로 제한하며, 불필요한 배경 이야기나 인물 관계·감정·사건 전개 등 부차적 정보는 포함하지 마십시오. 문장은 짧고 명료하게 구성하고, 전문적이고 중립적인 어투를 유지하여 독자가 즉시 핵심을 파악할 수 있도록 하십시오. 전체 답변은 질문에 대한 직접적이고 완결된 응답이 되도록 작성하십시오.",공항에서 가장 오래된 터미널은 마닐라 국내선 터미널(터미널 4)입니다.,0.6777039831143681,1855년 태국과 영국 사이에 맺은 조약은?,통상우호조약,1855년 태국과 영국은 통상우호조약을 체결했다.,0.5259369207002109
4,MDP-v3,"질문에 대한 핵심 답을 첫 문장에서 간단하고 정확하게 제시하십시오. 이후에는 문맥에서 확인된 주요 개념, 정의, 특징, 관련 예시를 짧고 명료한 문장으로 보충 설명하십시오. 불필요한 결론 표기나 감정적 표현은 배제하고, 전문적·중립적 어투를 유지하십시오. 정보는 반드시 제공된 문맥에 근거하며, 사실을 우선적으로 전달하고 필요 시 개념 간 관계나 배경을 간결하게 덧붙이되, 전체 답변은 한눈에 파악할 수 있게 완결성을 갖추십시오.",0.49296538532156137,"질문에 대한 답변은 문맥에서 확인된 핵심 정보만을 사용하여, 첫 문장에서 간결하고 정확하게 결론을 제시하십시오. 추가 설명은 반드시 질문에 직접 관련된 필수 사실이나 수치를 보충하는 범위로 제한하며, 불필요한 배경 이야기나 인물 관계·감정·사건 전개 등 부차적 정보는 포함하지 마십시오. 문장은 짧고 명료하게 구성하고, 전문적이고 중립적인 어투를 유지하여 독자가 즉시 핵심을 파악할 수 있도록 하십시오. 전체 답변은 질문에 대한 직접적이고 완결된 응답이 되도록 작성하십시오.",0.6777039831143681,"질문에 대한 답변은 첫 문장에서 필요한 핵심 용어나 명칭, 수치 등 직접적인 결론만 단독으로 제시하십시오. 그 후 추가 설명은 반드시 문맥에서 확인된 필수 정보만을 간결하게 보충하며, 불필요한 배경 서술이나 문학적 표현을 배제하십시오. 전체 문장은 짧고 단정하게 구성하고, 전문적이고 중립적인 어투를 유지하여 응답이 명확하고 압축된 형태로 완결성을 갖추도록 하십시오.","《트리 오브 라이프》. 2011년 테렌스 맬릭 감독의 실험적 드라마로, 브래드 피트와 함께 주연을 맡았다.",0.5516309157630234,채스테인이 2011년 브래드 피트와 함께 주연을 맡았던 영화는 무엇인가?,트리 오브 라이프,"《트리 오브 라이프》. 2011년 테렌스 맬릭 감독의 실험적 드라마로, 브래드 피트와 함께 주연을 맡았다.",0.3596735054977925
5,MDP-v3,"질문에 대한 답변은 문맥에서 확인된 핵심 정보만을 사용하여, 첫 문장에서 간결하고 정확하게 결론을 제시하십시오. 추가 설명은 반드시 질문에 직접 관련된 필수 사실이나 수치를 보충하는 범위로 제한하며, 불필요한 배경 이야기나 인물 관계·감정·사건 전개 등 부차적 정보는 포함하지 마십시오. 문장은 짧고 명료하게 구성하고, 전문적이고 중립적인 어투를 유지하여 독자가 즉시 핵심을 파악할 수 있도록 하십시오. 전체 답변은 질문에 대한 직접적이고 완결된 응답이 되도록 작성하십시오.",0.6777039831143681,"질문에 대한 답변은 첫 문장에서 필요한 핵심 용어나 명칭, 수치 등 직접적인 결론만 단독으로 제시하십시오. 그 후 추가 설명은 반드시 문맥에서 확인된 필수 정보만을 간결하게 보충하며, 불필요한 배경 서술이나 문학적 표현을 배제하십시오. 전체 문장은 짧고 단정하게 구성하고, 전문적이고 중립적인 어투를 유지하여 응답이 명확하고 압축된 형태로 완결성을 갖추도록 하십시오.",0.5516309157630234,"질문에 대한 답변은 첫 문장에서 질문에 맞는 정확한 결론만을 단독으로 제시하십시오. 결론에는 불필요한 수식어, 배경 설명, 인물·작품의 추가 정보 등을 포함하지 말고, 문맥에서 확인된 핵심 명칭이나 수치만 사용하십시오. 이후 문장은 추가 설명 없이 답변을 종료하며, 전체 어투는 간결하고 중립적으로 유지하여 한눈에 정답이 드러나도록 하십시오.",저스틴 팀버레이크.,0.9802047514224596,목탁수구리 윗턱에 있는 이빨의 갯수는?,47개,47개.,0.9671059552937102
6,MDP-v3,"질문에 대한 답변은 첫 문장에서 필요한 핵심 용어나 명칭, 수치 등 직접적인 결론만 단독으로 제시하십시오. 그 후 추가 설명은 반드시 문맥에서 확인된 필수 정보만을 간결하게 보충하며, 불필요한 배경 서술이나 문학적 표현을 배제하십시오. 전체 문장은 짧고 단정하게 구성하고, 전문적이고 중립적인 어투를 유지하여 응답이 명확하고 압축된 형태로 완결성을 갖추도록 하십시오.",0.5516309157630234,"질문에 대한 답변은 첫 문장에서 질문에 맞는 정확한 결론만을 단독으로 제시하십시오. 결론에는 불필요한 수식어, 배경 설명, 인물·작품의 추가 정보 등을 포함하지 말고, 문맥에서 확인된 핵심 명칭이나 수치만 사용하십시오. 이후 문장은 추가 설명 없이 답변을 종료하며, 전체 어투는 간결하고 중립적으로 유지하여 한눈에 정답이 드러나도록 하십시오.",0.9802047514224596,"질문에 대한 답변은 첫 문장에서 문맥에서 확인된 핵심 수치나 명칭을 정확히 제시하고, 단위나 조사 등을 포함하여 완전한 형태로 작성하십시오. 불필요한 수식어나 배경 설명은 제외하되, 의미가 모호해지지 않도록 문장을 자연스럽게 완결해 주십시오. 전체 어투는 간결하고 중립적으로 유지하며, 답변은 한 문장으로 명확하게 마무리하십시오.",삼촌 압둘 라힘 바치크가 결성하고 보컬로 활동한 밴드의 이름은 패밀리 그룹(Family Group)입니다.,0.543024791299859,마라의 쓴물이 단물로 변한 이야기는 성경의 어느 편인가?,출애굽,마라의 쓴물이 단물로 변한 이야기는 성경 출애굽기 15장에 기록되어 있습니다.,0.3210148560522595
7,MDP-v3,"질문에 대한 답변은 첫 문장에서 질문에 맞는 정확한 결론만을 단독으로 제시하십시오. 결론에는 불필요한 수식어, 배경 설명, 인물·작품의 추가 정보 등을 포함하지 말고, 문맥에서 확인된 핵심 명칭이나 수치만 사용하십시오. 이후 문장은 추가 설명 없이 답변을 종료하며, 전체 어투는 간결하고 중립적으로 유지하여 한눈에 정답이 드러나도록 하십시오.",0.9802047514224596,"질문에 대한 답변은 첫 문장에서 문맥에서 확인된 핵심 수치나 명칭을 정확히 제시하고, 단위나 조사 등을 포함하여 완전한 형태로 작성하십시오. 불필요한 수식어나 배경 설명은 제외하되, 의미가 모호해지지 않도록 문장을 자연스럽게 완결해 주십시오. 전체 어투는 간결하고 중립적으로 유지하며, 답변은 한 문장으로 명확하게 마무리하십시오.",0.543024791299859,"질문에 대한 답변은 첫 문장에서 문맥에서 확인된 핵심 명칭이나 단어만 단독으로 제시하십시오. 추가적인 장·절, 세부 수치, 사건 설명 등은 포함하지 말고, 불필요한 문장 연결이나 부연 없이 해당 단어만 정확하게 출력하십시오. 어투는 간결하고 중립적으로 유지하며, 답변은 한 단어 또는 최소한의 핵심어로만 완결하십시오.",2016년 1월,1.0000000000000009,경혜공주의 할아버지는?,세종,세종,1.0000000000000004
8,MDP-v3,"질문에 대한 답변은 첫 문장에서 문맥에서 확인된 핵심 수치나 명칭을 정확히 제시하고, 단위나 조사 등을 포함하여 완전한 형태로 작성하십시오. 불필요한 수식어나 배경 설명은 제외하되, 의미가 모호해지지 않도록 문장을 자연스럽게 완결해 주십시오. 전체 어투는 간결하고 중립적으로 유지하며, 답변은 한 문장으로 명확하게 마무리하십시오.",0.543024791299859,"질문에 대한 답변은 첫 문장에서 문맥에서 확인된 핵심 명칭이나 단어만 단독으로 제시하십시오. 추가적인 장·절, 세부 수치, 사건 설명 등은 포함하지 말고, 불필요한 문장 연결이나 부연 없이 해당 단어만 정확하게 출력하십시오. 어투는 간결하고 중립적으로 유지하며, 답변은 한 단어 또는 최소한의 핵심어로만 완결하십시오.",1.0000000000000009,"질문에 대한 답변은 문맥에서 확인된 핵심 정보를 첫 문장에서 완전한 문장으로 제시하십시오. 대상의 명칭, 인물 이름, 수치나 날짜 등 필수 요소를 정확히 포함하고, 필요한 경우 주어와 서술어를 갖춘 자연스러운 문장 형태로 작성하십시오. 불필요한 배경 설명이나 반복은 배제하되, 의미가 모호해지지 않도록 최소한의 필수 맥락을 포함하십시오. 어투는 간결하고 중립적으로 유지하며, 답변은 한 문장으로 명확히 완료하십시오.",아사미 유마의 부모님이 경영하던 가게는 일본 최초의 필리핀 펍이다.,0.6092596038860253,아사미 유마의 부모님이 경영하던 가게는?,필리핀 펍,아사미 유마의 부모님이 경영하던 가게는 일본 최초의 필리핀 펍이다.,0.451731435832182
9,MDP-v3,"질문에 대한 답변은 첫 문장에서 문맥에서 확인된 핵심 명칭이나 단어만 단독으로 제시하십시오. 추가적인 장·절, 세부 수치, 사건 설명 등은 포함하지 말고, 불필요한 문장 연결이나 부연 없이 해당 단어만 정확하게 출력하십시오. 어투는 간결하고 중립적으로 유지하며, 답변은 한 단어 또는 최소한의 핵심어로만 완결하십시오.",1.0000000000000009,"질문에 대한 답변은 문맥에서 확인된 핵심 정보를 첫 문장에서 완전한 문장으로 제시하십시오. 대상의 명칭, 인물 이름, 수치나 날짜 등 필수 요소를 정확히 포함하고, 필요한 경우 주어와 서술어를 갖춘 자연스러운 문장 형태로 작성하십시오. 불필요한 배경 설명이나 반복은 배제하되, 의미가 모호해지지 않도록 최소한의 필수 맥락을 포함하십시오. 어투는 간결하고 중립적으로 유지하며, 답변은 한 문장으로 명확히 완료하십시오.",0.6092596038860253,"질문에 대한 답변은 문맥에서 확인된 핵심 명칭이나 단어만을 정확히 제시하십시오. 추가적인 수식어, 배경 설명, 비교, 평가, 의미 부연 등을 포함하지 말고, 불필요한 문장 구조 없이 해당 단어 또는 짧은 구절만 출력하십시오. 답변은 간결하고 중립적인 어투로 작성하며, 불필요한 완전한 문장 형태나 주관적 표현을 배제하고 한 줄로만 제공합니다.",2011년,1.0000000000000009,달라이 라마의 시종이자 부리야트 몽골인으로 러시아어에 능통한 사람은 누구인가?,아왕 도르지에프,아왕 도르지에프,1.0000000000000002
10,MDP-v3,"질문에 대한 답변은 문맥에서 확인된 핵심 정보를 첫 문장에서 완전한 문장으로 제시하십시오. 대상의 명칭, 인물 이름, 수치나 날짜 등 필수 요소를 정확히 포함하고, 필요한 경우 주어와 서술어를 갖춘 자연스러운 문장 형태로 작성하십시오. 불필요한 배경 설명이나 반복은 배제하되, 의미가 모호해지지 않도록 최소한의 필수 맥락을 포함하십시오. 어투는 간결하고 중립적으로 유지하며, 답변은 한 문장으로 명확히 완료하십시오.",0.6092596038860253,"질문에 대한 답변은 문맥에서 확인된 핵심 명칭이나 단어만을 정확히 제시하십시오. 추가적인 수식어, 배경 설명, 비교, 평가, 의미 부연 등을 포함하지 말고, 불필요한 문장 구조 없이 해당 단어 또는 짧은 구절만 출력하십시오. 답변은 간결하고 중립적인 어투로 작성하며, 불필요한 완전한 문장 형태나 주관적 표현을 배제하고 한 줄로만 제공합니다.",1.0000000000000009,"질문에 대한 답변은 문맥에서 확인된 핵심 명칭이나 인물 이름, 지명, 수치, 날짜 등 필수 정보를 그대로 사용하여 제시하십시오. 불필요한 설명이나 부연 없이 정확한 표현을 한 줄로 작성하며, 필요 시 조사·어미를 최소화하여 핵심 정보만 전달합니다. 답변은 간결하고 중립적인 어투를 유지하고, 오타나 변형 없이 문맥에 나타난 표기를 그대로 사용하십시오.",가오리,0.9849296613630839,천박하고 뻔뻔스럽고 다른 사람에게 해를 끼치며 불량기 있는 행동을 하는 사람이란 뜻을 가진 단어는?,피카로,피카로(pícaro),0.9246483068154165
